{
  "schema_version": "ResearchRunManifestV1",
  "run_id": "demo_xrrna_prime_assembly_001",
  "slug": "xrrna-prime-assembly-demo",
  "title": "xrRNA-guided Prime Assembly",
  "short_title": "xrRNA / Prime Assembly",
  "subtitle": "Public-safe demonstration of a completed research-report workspace",
  "owner": "Scientific Core",
  "created_at": "2026-07-18T09:00:00Z",
  "updated_at": "2026-07-21T08:30:00Z",
  "status": "DONE",
  "terminal_state": "DEMO_CONTENT_COMPLETE",
  "research_domain": "Genome editing",
  "research_goal": "Demonstrate how a completed Scientific Core run can present a concise background, reviewed ideas, and a readable report without exposing private source material.",
  "summary": "This synthetic publication bundle demonstrates the finished-run experience: a clear scientific decision, two reviewed concepts, bilingual reading paths, and one-click access to canonical PDF artifacts.",
  "scientific_decision": "The demonstration retains one focused-test concept and one measurement-first concept. This is interface sample content, not a scientific endorsement.",
  "reading_order": ["Knowledge background", "Focused-test idea", "Measurement-first idea", "Technical details if needed"],
  "tags": ["prime editing", "RNA structure", "reporting"],
  "languages": ["en", "ko"],
  "visibility": "PUBLIC_SANITIZED",
  "publication_status": "DEMO_ONLY",
  "idea_count": 2,
  "reviewed_idea_count": 2,
  "retained_idea_count": 2,
  "report_count": 2,
  "knowledge_document_count": 1,
  "featured": true,
  "source_type": "SYNTHETIC_DEMO",
  "source_commit": "demo-not-linked-to-scientific-runtime",
  "source_bundle_hash": "sha256:demo-xrrna-bundle",
  "current_stage": "Publication demonstration",
  "progress_percent": 100,
  "timeline": [
    {"date": "2026-07-18", "label": "Framing", "detail": "The question and decision boundaries were recorded."},
    {"date": "2026-07-19", "label": "Review", "detail": "Two concepts were separated by experimental purpose."},
    {"date": "2026-07-21", "label": "Published", "detail": "A synthetic, public-safe report bundle was assembled."}
  ],
  "idea_refs": ["assembly-state-gate", "intermediate-readout"],
  "report_refs": [
    {"id": "xrrna-report-en", "title": "Idea report", "kind": "PDF", "path": "/artifacts/xrrna-prime-assembly-demo/idea-report-en.pdf", "language": "en"},
    {"id": "xrrna-report-ko", "title": "아이디어 보고서", "kind": "PDF", "path": "/artifacts/xrrna-prime-assembly-demo/idea-report-ko.pdf", "language": "ko"},
    {"id": "xrrna-measurement-en", "title": "Measurement report", "kind": "PDF", "path": "/artifacts/xrrna-prime-assembly-demo/measurement-report-en.pdf", "language": "en"},
    {"id": "xrrna-measurement-ko", "title": "측정 보고서", "kind": "PDF", "path": "/artifacts/xrrna-prime-assembly-demo/measurement-report-ko.pdf", "language": "ko"}
  ],
  "knowledge_refs": [
    {"id": "xrrna-knowledge", "title": "Knowledge background", "kind": "MARKDOWN", "path": "knowledge/knowledge-background-en.md", "language": "en"}
  ],
  "artifact_refs": [
    {"id": "xrrna-method-note", "title": "Demo publication note", "kind": "MARKDOWN", "path": "artifacts/demo-publication-note.md", "language": "en"}
  ]
}
